{
    "ReportTemplate": "paged.html",
    "DataSource": "",
    "PageHeadersHtml": "<table style=\"border-collapse:collapse;width: 100%;\"><tbody>\n<tr>\n\t<td style=\"width: 20%;text-align:left;\">{{OrgAddress1}}<br/>{{OrgAddress2}}<br/>{{OrgAddress3}}</td>\n\t<td style=\"width: 60%; text-align: center;\"><strong>{{OrgTitle}}<br/>{{ReportTitle}}<br/>{{ReportSubTitle}}</strong><br></td>\n\t<td style=\"width: 20%;text-align:right;\">{{CurrentDateTime}}</td></tr></tbody></table>",
    "PageFootersHtml": "<table style=\"border-collapse:collapse;width: 100%;\"><tbody>\n<tr>\n\t<td style=\"width: 20%;text-align:left;\">left footer line 1<br/>left footer line 2</td>\n\t<td style=\"width: 60%; text-align: center;\"><strong>{{Copyright}}</strong><br></td>\n\t<td style=\"width: 20%;text-align:right;\">right footer line 1</td></tr></tbody></table>",
    "ReportHeadersHtml":"",
    "ReportFootersHtml": "",
    "Content": [
        {"ContentHtml":"<p><br></p><p><br></p><table style=\"border-collapse: collapse; width: 852px; height: 278px;\">\n    <tbody>\n        <tr>\n            <td style=\"width: 21.4789%;\"><strong>Document #</strong><br></td>\n            <td style=\"width: 78.4038%;\">123123</td>\n        </tr>\n        <tr>\n            <td><strong>Received From</strong><br></td>\n            <td>{{ClientName}}<br></td>\n        </tr>\n        <tr>\n            <td><br></td>\n            <td><br></td>\n        </tr>\n        <tr>\n            <td><br></td>\n            <td>{{ClientAddress1}}</td>\n        </tr>\n        <tr>\n            <td><br></td>\n            <td>{{ClientAddress2}} <br></td>\n        </tr>\n        <tr>\n            <td><br></td>\n            <td>{{ClientAddress3}}<br></td>\n        </tr>\n        <tr>\n            <td><br></td>\n            <td>{{ClientState}} {{ClientPin}}</td>\n        </tr>\n    </tbody>\n</table><br><br><br><br><br><table style=\"border:none;width: 100%;\"><tbody>\n<tr>\n\t<td style=\"width: 12.2521%;\"><br></td>\n\t<td style=\"width: 20.6091%;\"><br></td>\n\t\n\t\n\t\n\t<td style=\"width: 43.7844%; text-align: center;\">{{OfficialName}}</td></tr>\n<tr>\n\t<td><strong>On</strong></td>\n\t<td>{{DocumentDate}}<br></td>\n\t\n\t\n\t\n\t<td style=\"text-align: center;\"><br></td></tr>\n<tr>\n\t<td><strong>At</strong></td>\n\t<td>{{DocumentTime}}</td>\n\t\n\t\n\t\n\t<td style=\"text-align: center;\">I certify that this is a true copy of the attached document.<br></td></tr>\n<tr>\n\t<td><strong>Cover Sheet</strong></td>\n\t<td>1</td>\n\t\n\t\n\t\n\t<td><br></td></tr>\n<tr>\n\t<td><strong>Total Pages</strong></td>\n\t<td>10</td>\n\t\n\t\n\t\n\t<td style=\" text-align: center;\">{{OfficialTitle}}</td></tr></tbody></table><p><br></p><p><br></p><p><br></p>"}
    ], 
    "Layout": {
        "PaperSize": "A4",
        "PaperLayout": "portrait",
        "Report-Top-Margin": 10,
        "Report-Right-Margin": 10,
        "Report-Bottom-Margin": 10,
        "Report-Left-Margin": 10,
        "Page-Header-Height": 30,
        "Page-Footer-Height": 20,
        "CustomStyle": ""
    }
}