{
    "Layout": {
        "PaperSize": "A4",
        "PaperLayout": "portrait",
        "Report-Top-Margin": 10,
        "Report-Right-Margin": 10,
        "Report-Bottom-Margin": 7,
        "Report-Left-Margin": 10,
        "Page-Header-Height": 30,
        "Page-Footer-Height": 20,
        "CustomStyle": ""
    },
    "Content": [
        {
            "DataSource": "jobsData",
            "TableContent": [
                {
                    "isPrint": true,
                    "field": "FileName",
                    "displayName": "File Name",
                    "columnSize": "",
                    "format": "",
                    "maxLength": 0,
                    "TitleStyle": "",
                    "ContentStyle": "",
                    "TotalCount": false
                },
                {
                    "isPrint": true,
                    "field": "SubmitedDate",
                    "displayName": "Submit Date",
                    "columnSize": "10ch",
                    "format": "shortdatetime",
                    "maxLength": 0,
                    "TitleStyle": "",
                    "ContentStyle": "",
                    "TotalCount": false
                },
                {
                    "isPrint": true,
                    "field": "SubmittedBy",
                    "displayName": "Submitted By",
                    "columnSize": "10ch",
                    "format": "",
                    "maxLength": 0,
                    "TitleStyle": "",
                    "ContentStyle": "",
                    "TotalCount": false
                },
                {
                    "isPrint": true,
                    "field": "PrintJobName",
                    "displayName": "Job Name",
                    "columnSize": "10ch",
                    "format": "",
                    "maxLength": 0,
                    "TitleStyle": "",
                    "ContentStyle": "",
                    "TotalCount": false
                },
                {
                    "isPrint": true,
                    "field": "Status",
                    "displayName": "Status",
                    "columnSize": "5em",
                    "format": "",
                    "maxLength": 0,
                    "TitleStyle": "",
                    "ContentStyle": "",
                    "TotalCount": false
                },
                {
                    "isPrint": true,
                    "field": "FileSize",
                    "displayName": "Size",
                    "columnSize": "10ch",
                    "format": "",
                    "maxLength": 0,
                    "TitleStyle": "",
                    "ContentStyle": "",
                    "TotalCount": false
                },
                {
                    "isPrint": true,
                    "field": "SubmitedDate",
                    "displayName": "Created",
                    "columnSize": "10ch",
                    "format": "shortdatetime",
                    "maxLength": 0,
                    "TitleStyle": "",
                    "ContentStyle": "",
                    "TotalCount": false
                },
                {
                    "isPrint": true,
                    "field": "JobType",
                    "displayName": "Job Type",
                    "columnSize": "10ch",
                    "format": "",
                    "maxLength": 0,
                    "TitleStyle": "",
                    "ContentStyle": "",
                    "TotalCount": false
                }
            ]
        },
        {
            "ContentHtml": "<br>Section 1:  Extra formatted HTML content can be placed here"
        },
        {
            "ContentHtml": "<br><br>Section 2:  Extra formatted HTML content can be placed here"
        }
    ],
    "ReportTemplate": "paged.html",
    "DataSource": "/test/Data/Samples/jobs.json",
    "PageHeadersHtml": "<table style=\"border-collapse:collapse;width: 100%;\"><tbody>\n<tr>\n\t<td style=\"width: 20%;text-align:left;\">{{OrgAddress1}}<br>{{OrgAddress2}}<br>{{OrgAddress3}}</td>\n\t<td style=\"width: 60%; text-align: center;\"><strong>{{OrgTitle}}<br>{{ReportTitle}}<br>Analysis for the period between {{ReportStartDate}} and {{ReportEndDate}}</strong><br></td>\n\t<td style=\"width: 20%;text-align:right;\">{{CurrentDateTime}}<br>Page{{PI}} of {{PC}}</td></tr></tbody></table>",
    "PageFootersHtml": "<table style=\"border-collapse:collapse;width: 100%;\"><tbody>\n<tr>\n\t<td style=\"width: 20%;text-align:left;\">left footer line 1<br>left footer line 2</td>\n\t<td style=\"width: 60%; text-align: center;\"><strong>{{Copyright}}</strong><br></td>\n\t<td style=\"width: 20%;text-align:right;\">right footer line 1</td></tr></tbody></table>",
    "ReportFootersHtml": "<table style=\"border-collapse:collapse;width: 100%;\"><tbody>\n<tr>\n\t<td style=\"width: 27.719%; text-align: left;\"><br></td>\n\t<td style=\"width: 48.4119%; text-align: center;\"><br>Report footer- This will appear only once per report at the end<br></td>\n\t<td style=\"width: 23.7729%; text-align: right;\"><br></td></tr></tbody></table>",
    "ReportHeadersHtml": "<table style=\"border-collapse:collapse;width: 100%;\"><tbody>\n<tr>\n\t<td style=\"width: 27.719%; text-align: left;\"><br></td>\n\t<td style=\"width: 48.4119%; text-align: center;\">Report Header- This will appear only once per report on the top<br></td>\n\t<td style=\"width: 23.7729%; text-align: right;\"><br></td></tr></tbody></table>"
}